X,Y
وہ غرایا اور غصّے میں آکر ایک چوہے کو اپنے پنجے میں دبوچ لیا۔,وہ غرایا اور غصّے میں آکر ایک چوہے کو اپنے پنجے میں دبوچ لیا۔
"ابھی وہ اسے مارنے ہی والا تھا کہ چوہے نے نہایت عاجزی سے کہا، ’’اے جنگل کے بادشاہ! مجھ غریب پر رحم کیجیے۔","ابھی وہ اسے مارنے ہی والا تھا کہ چوہے نے نہایت عاجزی سے کہا، ’’اے جنگل کے بادشاہ! مجھ غریب پر رحم کیجیے۔"
مجھ جیسے چھوٹے اور کمزور کو مارنے سے آپ کی خاندانی شرافت پر آنچ آئےگی اور سارے جنگل میں بدنامی ہوگی کہ جنگل کے بادشاہ شیر نے ایک چوہے کو مار دیا ہے۔,مجھ جیسے چھوٹے اور کمزور کو مارنے سے آپ کی خاندانی شرافت پر آنچ آئےگی اور سارے جنگل میں بدنامی ہوگی کہ جنگل کے بادشاہ شیر نے ایک چوہے کو مار دیا ہے۔
"” 

یہ بات سن کر شیر نے اس پر ترس کھایا اور ڈرتے کانپتے چوہے کو آزاد کر دیا۔","” 

یہ بات سن کر شیر نے اس پر ترس کھایا اور ڈرتے کانپتے چوہے کو آزاد کر دیا۔"
کچھ دن بعد وہی شیر شکار کے لیے جنگل میں نکلا۔,کچھ دن بعد وہی شیر شکار کے لیے جنگل میں نکلا۔
ابھی شکار کی تلاش میں وہ ادھر ادھر پھر ہی رہا تھا کہ اچانک شکاریوں کے جال میں پھنس گیا۔,ابھی شکار کی تلاش میں وہ ادھر ادھر پھر ہی رہا تھا کہ اچانک شکاریوں کے جال میں پھنس گیا۔
"اس نے نکلنے کے لیے بہت ہاتھ پاؤں مارے، لیکن جال سے نہ نکل سکا۔","اس نے نکلنے کے لیے بہت ہاتھ پاؤں مارے، لیکن جال سے نہ نکل سکا۔"
آخر پریشان اور لاچار ہو کر وہ پورے زور سے دھاڑا۔,آخر پریشان اور لاچار ہو کر وہ پورے زور سے دھاڑا۔
"جیسے ہی چوہے نے شیر کی دھاڑنے کی آواز سنی، وہ تیزی سے وہاں پہنچا۔","جیسے ہی چوہے نے شیر کی دھاڑنے کی آواز سنی، وہ تیزی سے وہاں پہنچا۔"
دیکھا کہ وہی شیر ہے جس نے اس کی جان بخشی تھی۔,دیکھا کہ وہی شیر ہے جس نے اس کی جان بخشی تھی۔
"وہ شیر کے پاس گیا اور کہا، ‘’اے بادشاہ سلامت! میں آپ کا دوست ہوں۔","وہ شیر کے پاس گیا اور کہا، ‘’اے بادشاہ سلامت! میں آپ کا دوست ہوں۔"
آپ نے میری جان بخشی تھی۔,آپ نے میری جان بخشی تھی۔
آپ بالکل فکر مت کریں۔,آپ بالکل فکر مت کریں۔
"” 

یہ کہہ کر وہ جلدی جلدی اپنے ننھے تیز دانتوں سے جال کاٹنے لگا اور ذرا سی دیر میں جال کاٹ کر شیر کو آزاد کرا دیا۔","” 

یہ کہہ کر وہ جلدی جلدی اپنے ننھے تیز دانتوں سے جال کاٹنے لگا اور ذرا سی دیر میں جال کاٹ کر شیر کو آزاد کرا دیا۔"
جب شیر آزاد ہوا تو اس نے سوچا کہ وہ بھی اس احسان کے بدلے کوئی احسان کرے۔,جب شیر آزاد ہوا تو اس نے سوچا کہ وہ بھی اس احسان کے بدلے کوئی احسان کرے۔
"یہ سوچ کر اس نے چوہے سے کہا، ‘’اے دوست! تو نے مجھ پر احسان کیا ہے۔","یہ سوچ کر اس نے چوہے سے کہا، ‘’اے دوست! تو نے مجھ پر احسان کیا ہے۔"
"جو تو مجھ سے مانگےگا، میں دوں گا۔","جو تو مجھ سے مانگےگا، میں دوں گا۔"
"بول کیا مانگتا ہے؟” 

چوہا یہ سن کر خوشی کے مارے پھولا نہ سمایا اور بھول گیا کہ وہ اپنے لائق کیا مانگے اور کون سی ایسی چیز مانگے کہ شیر اسے دے بھی سکے۔","بول کیا مانگتا ہے؟” 

چوہا یہ سن کر خوشی کے مارے پھولا نہ سمایا اور بھول گیا کہ وہ اپنے لائق کیا مانگے اور کون سی ایسی چیز مانگے کہ شیر اسے دے بھی سکے۔"
"اپنی حیثیت بھول کر اس نے جلدی سے کہا، ‘’اے بادشاہ سلامت! اپنی شیر زادی کی شادی مجھ سے کر دیجیے۔","اپنی حیثیت بھول کر اس نے جلدی سے کہا، ‘’اے بادشاہ سلامت! اپنی شیر زادی کی شادی مجھ سے کر دیجیے۔"
"” 

شیر زبان دے چکا تھا۔","” 

شیر زبان دے چکا تھا۔"
اس نے چوہے کی بات مان لی اور رشتہ قبول کر لیا۔,اس نے چوہے کی بات مان لی اور رشتہ قبول کر لیا۔
شادی کے دن نوجوان شیر زادی بن ٹھن کر نکلی اور جھومتی جھامتی اٹھکھیلیاں کرتی ہوئی بےفکری سے چلنے لگی۔,شادی کے دن نوجوان شیر زادی بن ٹھن کر نکلی اور جھومتی جھامتی اٹھکھیلیاں کرتی ہوئی بےفکری سے چلنے لگی۔
دولہا چوہا اس کے استقبال کے لیے سامنے کھڑا تھا کہ بےخیالی میں اتفاق سے شیر زادی دلہن کا پاؤں دولہا چوہے پر پڑ گیا اور وہ بے چارا وہیں پس کر ڈھیر ہو گیا۔,دولہا چوہا اس کے استقبال کے لیے سامنے کھڑا تھا کہ بےخیالی میں اتفاق سے شیر زادی دلہن کا پاؤں دولہا چوہے پر پڑ گیا اور وہ بے چارا وہیں پس کر ڈھیر ہو گیا۔
۔,۔
یہ اس زمانے کا ذکر ہے جب بندوق ایجاد نہیں ہوئی تھی اور لوگ تیر کمان سے شکار کھیلتے تھے۔,یہ اس زمانے کا ذکر ہے جب بندوق ایجاد نہیں ہوئی تھی اور لوگ تیر کمان سے شکار کھیلتے تھے۔
ایک دن کچھ شکاری شکار کی تلاش میں جنگل میں پھر رہے تھے کہ اچانک ان کی نظر ایک ہرن پر پڑی۔,ایک دن کچھ شکاری شکار کی تلاش میں جنگل میں پھر رہے تھے کہ اچانک ان کی نظر ایک ہرن پر پڑی۔
وہ سب اس کے پیچھے ہو لیے۔,وہ سب اس کے پیچھے ہو لیے۔
شکاری ہرن کو چاروں طرف سے گھیر رہے تھے اور ہرن اپنی جان بچانے کے لی ےتیزی سے بھاگ تھا۔,شکاری ہرن کو چاروں طرف سے گھیر رہے تھے اور ہرن اپنی جان بچانے کے لی ےتیزی سے بھاگ تھا۔
جب وہ بھاگتے بھاگتے تھک گیا توا یک گھنی انگور کی بیل کے اندر جا چھپا۔,جب وہ بھاگتے بھاگتے تھک گیا توا یک گھنی انگور کی بیل کے اندر جا چھپا۔
"شکاریوں نے اسے بہت تلاش کیا، لیکن اس کا کچھ پتا نہیں چلا۔","شکاریوں نے اسے بہت تلاش کیا، لیکن اس کا کچھ پتا نہیں چلا۔"
آخر مایوس ہوکر وہ وہاں سے لوٹنے لگے۔,آخر مایوس ہوکر وہ وہاں سے لوٹنے لگے۔
"جب کچھ وقت گزر گیا تو ہرن نے سوچا کہ اب خطرہ ٹل گیا ہے اور وہ بے فکر ہوکر مزے سے اسی انگور کی بیل کے پتے کھانے لگا، جس میں وہ چھپا ہوا تھا۔","جب کچھ وقت گزر گیا تو ہرن نے سوچا کہ اب خطرہ ٹل گیا ہے اور وہ بے فکر ہوکر مزے سے اسی انگور کی بیل کے پتے کھانے لگا، جس میں وہ چھپا ہوا تھا۔"
"ایک شکاری جو سب سے پیچھے تھا، جب وہاں سے گزرا تو انگور کی بیل اور اس کے گچھوں کو ہلتے دیکھ کر سمجھا کہ یہاں ضرور کوئی جانور چھپا ہے۔","ایک شکاری جو سب سے پیچھے تھا، جب وہاں سے گزرا تو انگور کی بیل اور اس کے گچھوں کو ہلتے دیکھ کر سمجھا کہ یہاں ضرور کوئی جانور چھپا ہے۔"
اس نے تاک کے کئی تیر مارے۔,اس نے تاک کے کئی تیر مارے۔
اتفاق سے ایک تیر ہرن کو جا لگا اور وہ وہیں ڈھیر ہو گیا۔,اتفاق سے ایک تیر ہرن کو جا لگا اور وہ وہیں ڈھیر ہو گیا۔
"مرتے ہوئے ہرن نے اپنے دل میں کہا، ‘’اے بدبخت! تیری ناشکری کی یہی سزا ہے۔","مرتے ہوئے ہرن نے اپنے دل میں کہا، ‘’اے بدبخت! تیری ناشکری کی یہی سزا ہے۔"
"مصیبت کے وقت جس نے تجھے پناہ دی، تو نے اسی پر ظلم ڈھایا۔","مصیبت کے وقت جس نے تجھے پناہ دی، تو نے اسی پر ظلم ڈھایا۔"
"” 

اتنے میں شکاری بھی وہاں پہنچ گئے۔","” 

اتنے میں شکاری بھی وہاں پہنچ گئے۔"
کیا دیکھتے ہیں وہی ہرن مرا پڑا ہے۔,کیا دیکھتے ہیں وہی ہرن مرا پڑا ہے۔
۔,۔
کسی گاؤں میں ایک بوڑھا اور بڑھیا رہا کرتے تھے۔,کسی گاؤں میں ایک بوڑھا اور بڑھیا رہا کرتے تھے۔
ان کے پاس پوچی نام کا ایک کتا تھا۔,ان کے پاس پوچی نام کا ایک کتا تھا۔
اس کو دونوں بہت پیار کرتے تھے۔,اس کو دونوں بہت پیار کرتے تھے۔
"ایک دن جب بوڑھا اپنے کھیت میں کام کر رہا تھا، پوچی اسے کھینچ کر ایک طرف لے گیا اور بھونک بھونک کر پنجوں سے زمین کریدنے لگا۔","ایک دن جب بوڑھا اپنے کھیت میں کام کر رہا تھا، پوچی اسے کھینچ کر ایک طرف لے گیا اور بھونک بھونک کر پنجوں سے زمین کریدنے لگا۔"
بوڑھا جتنا بھی اسے ہٹانے کی کوشش کرتا پوچی اتنے ہی زور سے بھوں بھوں کرتے ہوئے پھر زمین کریدنے لگتا۔,بوڑھا جتنا بھی اسے ہٹانے کی کوشش کرتا پوچی اتنے ہی زور سے بھوں بھوں کرتے ہوئے پھر زمین کریدنے لگتا۔
آخر بوڑھے نے پھاوڑا اٹھاکر اس جگہ کو کھودنا شروع کیا۔,آخر بوڑھے نے پھاوڑا اٹھاکر اس جگہ کو کھودنا شروع کیا۔
کھودنے پر وہاں سے ہیرے اور موتیوں سے بھرا ہوا گھڑا نکلا جسے پاکر بوڑھا بہت خوش ہوا اور سارا خزانہ لے کر اپنے گھر آ گیا۔,کھودنے پر وہاں سے ہیرے اور موتیوں سے بھرا ہوا گھڑا نکلا جسے پاکر بوڑھا بہت خوش ہوا اور سارا خزانہ لے کر اپنے گھر آ گیا۔
بوڑھے کا ایک پڑوسی تھا۔,بوڑھے کا ایک پڑوسی تھا۔
بےحد لالچی۔,بےحد لالچی۔
اس نے بوڑھے کو خزانہ لاتے ہوئے دیکھا تو پوچھ لیا۔,اس نے بوڑھے کو خزانہ لاتے ہوئے دیکھا تو پوچھ لیا۔
بوڑھا تھا سیدھا سادھا۔,بوڑھا تھا سیدھا سادھا۔
اس نے پڑوسی کو خزانہ ملنے کا سارا واقعہ کہہ سنایا۔,اس نے پڑوسی کو خزانہ ملنے کا سارا واقعہ کہہ سنایا۔
جلن کی وجہ سے پڑوسی کی نیند اڑ گئی۔,جلن کی وجہ سے پڑوسی کی نیند اڑ گئی۔
اگلے دن اس نے میٹھی میٹھی باتیں کر کے بوڑھے سے ایک دن کے لئے پوچی کو مانگ لیا۔,اگلے دن اس نے میٹھی میٹھی باتیں کر کے بوڑھے سے ایک دن کے لئے پوچی کو مانگ لیا۔
اسے لے کر وہ سیدھے اپنے کھیت میں گیا اور بار بار کتے کو تنگ کرنے لگا کہ وہ اسے بھی خزانہ دکھائے۔,اسے لے کر وہ سیدھے اپنے کھیت میں گیا اور بار بار کتے کو تنگ کرنے لگا کہ وہ اسے بھی خزانہ دکھائے۔
آخر پوچی نے ایک جگہ کر پنجوں سے زمین کریدنی شروع ہی کی تھی کہ پڑوسی نے جھٹ پھاوڑے سے وہ جگہ کھود ڈالی۔,آخر پوچی نے ایک جگہ کر پنجوں سے زمین کریدنی شروع ہی کی تھی کہ پڑوسی نے جھٹ پھاوڑے سے وہ جگہ کھود ڈالی۔
کھونے پر ہیرے موتیوں کے بجائے اسے ملا کوڑا اور گندا کچڑا۔,کھونے پر ہیرے موتیوں کے بجائے اسے ملا کوڑا اور گندا کچڑا۔
پڑوسی نے جھلاہٹ میں آؤ دیکھا نہ تاؤ اور پوچی کو مار کر پھینک دیا۔,پڑوسی نے جھلاہٹ میں آؤ دیکھا نہ تاؤ اور پوچی کو مار کر پھینک دیا۔
جب پوچی کے مالک بوڑھے کو معلوم ہوا تو وہ بہت دکھی ہوا۔,جب پوچی کے مالک بوڑھے کو معلوم ہوا تو وہ بہت دکھی ہوا۔
اس نے پوچی کی لاش کو گاڑ کر وہاں پر ایک پیڑ اگا دیا۔,اس نے پوچی کی لاش کو گاڑ کر وہاں پر ایک پیڑ اگا دیا۔
حیرانی کی بات کہ دو دن میں ہی وہ بڑھ کر پورا پیڑ بن گیا۔,حیرانی کی بات کہ دو دن میں ہی وہ بڑھ کر پورا پیڑ بن گیا۔
بوڑھے نے اس پیڑ کی لکڑی سے اوکھلی بنائی نئے سال کے پکوان بنانے کے لیے اس میں دھان کوٹنے لگا تو اوکھلی میں پڑا دھان سونے اور چاندی کے سکوں میں بدلنے لگا۔,بوڑھے نے اس پیڑ کی لکڑی سے اوکھلی بنائی نئے سال کے پکوان بنانے کے لیے اس میں دھان کوٹنے لگا تو اوکھلی میں پڑا دھان سونے اور چاندی کے سکوں میں بدلنے لگا۔
پڑوسی کو بھی معلوم ہوا تو وہ اوکھلی ادھار مانگ کر لے گیا۔,پڑوسی کو بھی معلوم ہوا تو وہ اوکھلی ادھار مانگ کر لے گیا۔
جب اس نے اوکھلی میں دھان کوٹے تو دھان گندگی اور کوڑے میں بدل گیا۔,جب اس نے اوکھلی میں دھان کوٹے تو دھان گندگی اور کوڑے میں بدل گیا۔
پڑوسی نے غصے میں اوکھلی کو آگ میں جلا ڈالا۔,پڑوسی نے غصے میں اوکھلی کو آگ میں جلا ڈالا۔
بوڑھے نے دکھے ہوئے دل سے جلی ہوئی اوکھلی کی راکھ اکٹھا کی اور اسے اپنے آنگن میں چھڑک دیا۔,بوڑھے نے دکھے ہوئے دل سے جلی ہوئی اوکھلی کی راکھ اکٹھا کی اور اسے اپنے آنگن میں چھڑک دیا۔
وہ راکھ جہاں جہاں پڑی وہاں سوکھی گھاس ہری ہو گئی اور سوکھے ہوئے پیڑوں کی ڈالیاں پھولوں سے لد گئیں۔,وہ راکھ جہاں جہاں پڑی وہاں سوکھی گھاس ہری ہو گئی اور سوکھے ہوئے پیڑوں کی ڈالیاں پھولوں سے لد گئیں۔
اسی وقت وہاں سے بادشاہ کی سواری نکل رہی تھی۔,اسی وقت وہاں سے بادشاہ کی سواری نکل رہی تھی۔
بادشاہ نے پھولوں سے لدے پیڑوں کو دیکھا۔,بادشاہ نے پھولوں سے لدے پیڑوں کو دیکھا۔
اس کا دل خوش ہو گیا اور اس نے بوڑھے کو اشرفیوں کی تھیلی انعام میں دی۔,اس کا دل خوش ہو گیا اور اس نے بوڑھے کو اشرفیوں کی تھیلی انعام میں دی۔
حاسد پڑوسی نے یہ دیکھا تو بچی ہوئی راکھ اٹھالی اور بادشاہ کے راستے میں جاکر ایک سوکھے پیڑ پر راکھ ڈالی۔,حاسد پڑوسی نے یہ دیکھا تو بچی ہوئی راکھ اٹھالی اور بادشاہ کے راستے میں جاکر ایک سوکھے پیڑ پر راکھ ڈالی۔
پیڑ ویسا ہی ٹھنٹ بنا رہا پر راکھ اڑ کر بادشاہ کی آنکھوں میں جا پڑی۔,پیڑ ویسا ہی ٹھنٹ بنا رہا پر راکھ اڑ کر بادشاہ کی آنکھوں میں جا پڑی۔
بادشاہ کے سپاہیوں نے اسے پکڑ لیا اور اسے خوب پیٹا۔,بادشاہ کے سپاہیوں نے اسے پکڑ لیا اور اسے خوب پیٹا۔
بوڑھا آس پڑوس میں پھول والے دادا جی کے نام سے مشہور ہو گیا۔,بوڑھا آس پڑوس میں پھول والے دادا جی کے نام سے مشہور ہو گیا۔
۔,۔
ایک دفعہ کا ذکر ہے کہ ایک شہزادہ تھا جو صرف کسی شہزادی ہی سے شادی کرنا چاہتا تھا لیکن وہ ایک اصلی شہزادی ہونی چاہئے تھی۔,ایک دفعہ کا ذکر ہے کہ ایک شہزادہ تھا جو صرف کسی شہزادی ہی سے شادی کرنا چاہتا تھا لیکن وہ ایک اصلی شہزادی ہونی چاہئے تھی۔
اس نے پوری دنیا کا سفر کیا تاکہ ایسی شہزادی کو تلاش کر سکے۔,اس نے پوری دنیا کا سفر کیا تاکہ ایسی شہزادی کو تلاش کر سکے۔
لیکن وہ جو چاہتا تھا وہ اسے کسی بھی جگہ نہ ملی۔,لیکن وہ جو چاہتا تھا وہ اسے کسی بھی جگہ نہ ملی۔
ان کے متعلق ہمیشہ کوئی نہ کوئی ایک بات ایسی ہوتی جو ویسی نہ ہوتی جیسی ہونی چاہئے تھی۔,ان کے متعلق ہمیشہ کوئی نہ کوئی ایک بات ایسی ہوتی جو ویسی نہ ہوتی جیسی ہونی چاہئے تھی۔
سو وہ گھر لوٹ آیا اور اداس رہنے لگا۔,سو وہ گھر لوٹ آیا اور اداس رہنے لگا۔
کیونکہ اسے بہت خواہش تھی کہ اسے ایک اصلی شہزادی مل جائے۔,کیونکہ اسے بہت خواہش تھی کہ اسے ایک اصلی شہزادی مل جائے۔
اچانک محل کا دروازہ کھڈکھٹائے جانے کی آواز سنائی دی اور بوڑھا بادشاہ اسے کھولنے کے لیے خود گیا۔,اچانک محل کا دروازہ کھڈکھٹائے جانے کی آواز سنائی دی اور بوڑھا بادشاہ اسے کھولنے کے لیے خود گیا۔
یہ ایک شہزادی تھی جو وہاں باہر دروازے کے سامنے کھڑی تھی۔,یہ ایک شہزادی تھی جو وہاں باہر دروازے کے سامنے کھڑی تھی۔
لیکن اف خدایا! بارش اور ہوا نے اس کا حلیہ کیسا بنا دیا تھا۔,لیکن اف خدایا! بارش اور ہوا نے اس کا حلیہ کیسا بنا دیا تھا۔
"’’اچھا، چلو ٹھیک ہے! ہم جلد ہی پتا لگا لیں گے۔","’’اچھا، چلو ٹھیک ہے! ہم جلد ہی پتا لگا لیں گے۔"
اس بستر پر شہزادی کو سلایا گیا۔,اس بستر پر شہزادی کو سلایا گیا۔
صبح انہوں نے اس سے پوچھا کہ وہ رات کیسے سوئی تھی۔,صبح انہوں نے اس سے پوچھا کہ وہ رات کیسے سوئی تھی۔
"’’اوہ، بہت ہی بری طرح سے!‘‘ اس نے کہا۔","’’اوہ، بہت ہی بری طرح سے!‘‘ اس نے کہا۔"
’’میں اپنی آنکھیں شاید ساری رات بند نہیں کر سکی۔,’’میں اپنی آنکھیں شاید ساری رات بند نہیں کر سکی۔
جہاں اسے ابھی بھی دیکھا جا سکتا ہے بشرطیکہ کسی نے اسے وہاں سے چوری نہ کر لیا ہو۔,جہاں اسے ابھی بھی دیکھا جا سکتا ہے بشرطیکہ کسی نے اسے وہاں سے چوری نہ کر لیا ہو۔
"دیکھا، اسے کہتے اصلی کہانی۔","دیکھا، اسے کہتے اصلی کہانی۔"
ایک سپاہی تھے۔,ایک سپاہی تھے۔
وہ کہیں سے چلے آتے تھے۔,وہ کہیں سے چلے آتے تھے۔
اس نے دیکھا۔,اس نے دیکھا۔
تو ادھر ادھر کوئی نظر نہ آیا۔,تو ادھر ادھر کوئی نظر نہ آیا۔
بھینا کھیت سری نے کہا ہے بھینا راہ سری تو مر گئی۔,بھینا کھیت سری نے کہا ہے بھینا راہ سری تو مر گئی۔
کہ ہے ہے بھینا گھورے تلے آئیں۔,کہ ہے ہے بھینا گھورے تلے آئیں۔
ہے ہے بھینا چھکڑے تلے آئیں۔,ہے ہے بھینا چھکڑے تلے آئیں۔
ہے ہے بھینا اونٹوں تلے آئیں‘‘۔,ہے ہے بھینا اونٹوں تلے آئیں‘‘۔
یہ کہہ کر چوہیا اپنے کھیت میں اتر گئی۔,یہ کہہ کر چوہیا اپنے کھیت میں اتر گئی۔
سپاہی اپنے گھر چلا آیا۔,سپاہی اپنے گھر چلا آیا۔
جب سپاہی کھانے پینے سے فارغ ہوکر اپنے بال بچوں میں بیٹھا۔,جب سپاہی کھانے پینے سے فارغ ہوکر اپنے بال بچوں میں بیٹھا۔
تو بیوی سے کہا کہ بیوی ایک ہم نے بڑا اچنبا دیکھا۔,تو بیوی سے کہا کہ بیوی ایک ہم نے بڑا اچنبا دیکھا۔
بیوی نے پوچھا میاں کیا دیکھا؟ کہا بیوی میں چلا آتا تھا۔,بیوی نے پوچھا میاں کیا دیکھا؟ کہا بیوی میں چلا آتا تھا۔
میں نے ادھر ادھر دیکھا۔,میں نے ادھر ادھر دیکھا۔
مجھے کوئی نظر نہ آیا۔,مجھے کوئی نظر نہ آیا۔
میں نے پھر گھوڑا ہانکا۔,میں نے پھر گھوڑا ہانکا۔
پھر آواز آئی۔,پھر آواز آئی۔
دیکھتا کیا ہوں کہ ایک چوہیا کھیت کی مینڈیر پر پھدک رہی ہے۔,دیکھتا کیا ہوں کہ ایک چوہیا کھیت کی مینڈیر پر پھدک رہی ہے۔
بھینا کھیت سری نے کہا ہے۔,بھینا کھیت سری نے کہا ہے۔
بھینا راہ سری تو مر گئی۔,بھینا راہ سری تو مر گئی۔
ہے ہے بھینا چھکڑے تلے آئیں ہے ہے بھینا اونٹوں تلے آئیں‘‘۔,ہے ہے بھینا چھکڑے تلے آئیں ہے ہے بھینا اونٹوں تلے آئیں‘‘۔
رو پیٹ کر وہ بی چوہیا پھر چکی تلے گھس گئیں۔,رو پیٹ کر وہ بی چوہیا پھر چکی تلے گھس گئیں۔
سپاہی نے بیوی سے کہا۔,سپاہی نے بیوی سے کہا۔
جیسا یہ تماشا تم نے اب دیکھا۔,جیسا یہ تماشا تم نے اب دیکھا۔
ویسا ہی تماشا میں نے تب دیکھا تھا۔,ویسا ہی تماشا میں نے تب دیکھا تھا۔
ننھی شیلا ایک دن اپنی گڑیوں کے لئے چائے بنا رہی تھی۔,ننھی شیلا ایک دن اپنی گڑیوں کے لئے چائے بنا رہی تھی۔
کہ یکایک اس کے گھر کے دروازے پر دستک ہوئی۔,کہ یکایک اس کے گھر کے دروازے پر دستک ہوئی۔
شیلا نے خیال کیا کہ اس کی کوئی سہیلی اس سے ملنے آئی ہے۔,شیلا نے خیال کیا کہ اس کی کوئی سہیلی اس سے ملنے آئی ہے۔
لیکن جب اس نے دروازہ کھولا تو دیکھا کہ ایک عورت اپنے تین بچوں کو گود میں لئے کھڑی ہے۔,لیکن جب اس نے دروازہ کھولا تو دیکھا کہ ایک عورت اپنے تین بچوں کو گود میں لئے کھڑی ہے۔
شیلا اسے مسکراتا دیکھ کر کہنے لگی۔,شیلا اسے مسکراتا دیکھ کر کہنے لگی۔
واپس آئی تو دیکھا کہ اس کی خوبصورت مہمان غائب ہے۔,واپس آئی تو دیکھا کہ اس کی خوبصورت مہمان غائب ہے۔
لیکن غسل خانہ خوشبوؤں سے مہک رہا ہے۔,لیکن غسل خانہ خوشبوؤں سے مہک رہا ہے۔
اسے دیکھتے ہی شیلا کے منہ سے مارے خوشی کے ایک چیخ نکل گئی۔,اسے دیکھتے ہی شیلا کے منہ سے مارے خوشی کے ایک چیخ نکل گئی۔
اس نے دوڑ کر اسے پہن لیا۔,اس نے دوڑ کر اسے پہن لیا۔
دستانہ پہنتے ہی وہ ایک اور ہی دنیا میں پہنچ گئی۔,دستانہ پہنتے ہی وہ ایک اور ہی دنیا میں پہنچ گئی۔
